Species,Similarity
Carassius auratus (Goldfish),1527.3699336295947
Cyprinus carpio carpio (Common carp),1329.5449702583292
Oncorhynchus kisutch (Coho salmon),1316.7252564419819
Sinocyclocheilus grahami (Golden-line barbel),1233.3473645455483
Salmo salar (Atlantic salmon),1164.163544982051
Salmo trutta (Brown trout),1106.5174981124617
Canis lupus familiaris (Dog - Boxer),1062.494849088049
Hucho hucho (Huchen),1058.5977264349945
Oncorhynchus mykiss (Rainbow trout),834.6358036425634
Oncorhynchus tshawytscha (Chinook salmon),804.8243063850853
Paramormyrops kingsleyae (Paramormyrops kingsleyae),748.6353156956594
Scleropages formosus two (Asian bonytongue),697.9582894776713
Fundulus heteroclitus (Mummichog),692.9177595333091
Xiphophorus maculatus (Platyfish),688.5482006827857
Maylandia zebra (Zebra mbuna),667.2314844989103
Poecilia formosa (Amazon molly),666.8394852331978
Danio rerio (Zebrafish),663.5859393989939
Electrophorus electricus (Electric eel),661.7749310561113
Scleropages formosus (Asian bonytongue),657.4249037176355
Strigops habroptila (Kakapo),628.397838686848
Gadus morhua (Atlantic cod),622.4537742316147
Pygocentrus nattereri (Red-bellied piranha),621.6605976402343
Poecilia latipinna (Sailfin molly),618.373621134444
Acanthochromis polyacanthus (Spiny chromis),617.6489638653613
Betta splendens (Siamese fighting fish),616.5769738201243
Dicentrarchus labrax (European seabass),616.0619644903727
Gorilla gorilla gorilla (Gorilla),614.1548686084536
Poecilia reticulata (Guppy),610.1698158007829
Oryzias latipes (Japanese medaka HdrR),609.6674032330357
Nothobranchius furzeri (Turquoise killifish),609.0218286616888
Cyprinodon variegatus (Sheepshead minnow),607.255214896792
Cynoglossus semilaevis (Tongue sole),602.9991262818007
Oryzias melastigma (Indian medaka),602.3528630925402
Oryzias javanicus (Javanese ricefish),601.6059203288643
Balaenoptera musculus (Blue whale),592.0187474191474
Pan troglodytes (Chimpanzee),591.6521626243557
Cercocebus atys (Sooty mangabey),578.7922892532745
Macaca nemestrina (Pig-tailed macaque),578.2109959330307
Rhinopithecus roxellana (Golden snub-nosed monkey),572.3148145322508
Rhinopithecus bieti (Black snub-nosed monkey),571.589031829239
Cebus imitator (Panamanian white-faced capuchin),568.2043661242158
Papio anubis (Olive baboon),566.561677971097
Amphilophus citrinellus (Midas cichlid),566.3710913840746
Aotus nancymaae (Ma's night monkey),565.9448659420193
Amphiprion percula (Orange clownfish),565.5721204401867
Oryzias sinensis (Chinese medaka),564.1463727247863
Stegastes partitus (Bicolor damselfish),563.7383501220821
Mastacembelus armatus (Zig-zag eel),562.6244882267332
Amphiprion ocellaris (Clown anemonefish),561.0485489707982
Lates calcarifer (Barramundi perch),560.8455594234878
Kryptolebias marmoratus (Mangrove rivulus),560.2364974979264
Seriola lalandi dorsalis (Yellowtail amberjack),560.1506034673429
Seriola dumerili (Greater amberjack),558.1303301212437
Sparus aurata (Gilthead seabream),556.9181344748099
Anabas testudineus (Climbing perch),555.7673944050753
Takifugu rubripes (Fugu),555.277231144691
Pongo abelii (Sumatran orangutan),554.5841023788504
Scophthalmus maximus (Turbot),554.4222133129772
Callithrix jacchus (White-tufted-ear marmoset),552.8226990550008
Esox lucius (Northern pike),551.570433030277
Propithecus coquereli (Coquerel's sifaka),549.885475910177
Cyclopterus lumpus (Lumpfish),547.877433114214
Prolemur simus (Greater bamboo lemur),547.33135110217
Labrus bergylta (Ballan wrasse),546.8921971600423
Larimichthys crocea (Large yellow croaker),546.048362833869
Macaca mulatta (Macaque),545.9006207528988
Haplochromis burtoni (Burton's mouthbrooder),545.8032314889982
Panthera leo (Lion),545.5712153379468
Pundamilia nyererei (Makobe Island cichlid),545.5574204624992
Phocoena sinus (Vaquita),543.0371122196518
Physeter catodon (Sperm whale),542.4058037464446
Sus scrofa (Pig - Hampshire),541.7472619003493
Macaca fascicularis (Crab-eating macaque),540.8345101076022
Sciurus vulgaris (Eurasian red squirrel),540.0294685436727
Neolamprologus brichardi (Lyretail cichlid),539.9104978151657
Bos taurus (Cow),538.2194588715537
Felis catus (Cat),538.2136397632413
Urocitellus parryii (Arctic ground squirrel),535.9644278995631
Rhinolophus ferrumequinum (Greater horseshoe bat),535.8078205898286
Ovis aries (Sheep),534.4548091755299
Gasterosteus aculeatus (Stickleback),533.6412974319893
Heterocephalus glaber (Naked mole-rat),530.114472476504
Microcebus murinus (Mouse Lemur),529.5470908413281
Moschus moschiferus (Siberian musk deer),528.7962801472024
Octodon degus (Degu),528.6187069562523
Ictalurus punctatus (Channel catfish),528.592902989784
Bos grunniens (Domestic yak),528.4098379691429
Otolemur garnettii (Bushbaby),526.9031761589608
Delphinapterus leucas (Beluga whale),526.8387479243665
Monodon monoceros (Narwhal),526.1220726637956
Catagonus wagneri (Chacoan peccary),525.2421048889474
Neovison vison (American mink),521.1329282248311
Microtus ochrogaster (Prairie vole),520.3760987041661
Capra hircus (Goat (black bengal)),519.8119820683539
Denticeps clupeoides (Denticle herring),519.5898269899418
Chlorocebus sabaeus (Vervet-AGM),517.4790335059035
Equus asinus (Donkey),516.3606999392057
Jaculus jaculus (Lesser Egyptian jerboa),516.3130432550967
Peromyscus maniculatus bairdii (Northern American deer mouse),516.2326764766683
Mus caroli (Ryukyu mouse),516.083727762696
Bos indicus x Bos taurus (Hybrid - Bos Taurus),515.8688567465357
Mus spretus (Algerian mouse),515.1077382633948
Mus pahari (Shrew mouse),515.0053326625952
Myripristis murdjan (Pinecone soldierfish),512.9470430107942
Sander lucioperca (Pike-perch),511.4100014664691
Equus caballus (Horse),511.171343309024
Mesocricetus auratus (Golden Hamster),510.93137108031067
Rattus norvegicus (Rat),510.51284109815526
Ailuropoda melanoleuca (Giant panda),510.111360005777
Oreochromis niloticus (Nile tilapia),509.93263039394344
Mus musculus (Mouse),509.46973936962536
Loxodonta africana (Elephant),508.3497527885899
Cricetulus griseus (Chinese hamster CriGri),507.6360679006859
Panthera pardus (Leopard),507.25495081690485
Cervus hanglu yarkandensis (Yarkand deer),505.43200569581563
Ursus americanus (American black bear),503.79757766875707
Nannospalax galili (Upper Galilee mountains blind mole rat),501.1195050351201
Cavia porcellus (Guinea Pig),496.4330932175976
Tetraodon nigroviridis (Tetraodon),495.35998158610937
Hippocampus comes (Tiger tail seahorse),492.62543136513364
Chinchilla lanigera (Long-tailed chinchilla),491.2637039233778
Cottoperca gobio (Channel bull blenny),491.0820631955248
Mus spicilegus (Steppe mouse),490.15947838465655
Dasypus novemcinctus (Armadillo),487.1079361714552
Ictidomys tridecemlineatus (Squirrel),484.61064586027925
Astatotilapia calliptera (Eastern happy),483.41838918277614
Mustela putorius furo (Ferret),475.22500952783764
Marmota marmota marmota (Alpine marmot),470.20825062444476
Nomascus leucogenys (Gibbon),462.68275972815286
Vombatus ursinus (Common wombat),462.3436706190672
Taeniopygia guttata (Zebra finch),459.8626281008174
Sarcophilus harrisii (Tasmanian devil),457.3844608172202
Pan paniscus (Bonobo),456.84155895190054
Monodelphis domestica (Opossum),448.9122121648051
Anser brachyrhynchus (Pink-footed goose),448.1559934577597
Coturnix japonica (Japanese quail),445.60014643226833
Camelus dromedarius (Arabian camel),443.26313853938217
Chelonoidis abingdonii (Abingdon island giant tortoise),440.6678655417222
Saimiri boliviensis boliviensis (Bolivian squirrel monkey),439.92926965155027
Salvator merianae (Argentine black and white tegu),436.9598835721572
Chrysemys picta bellii (Painted turtle),434.1121547332232
Pteropus vampyrus (Megabat),433.5469370909796
Aquila chrysaetos chrysaetos (Golden eagle),428.0971446919399
Laticauda laticaudata (Blue-ringed sea krait),416.6048545563723
Leptobrachium leishanense (Leishan spiny toad),414.423431894013
Pelodiscus sinensis (Chinese softshell turtle),414.2067099294584
Lepisosteus oculatus (Spotted gar),413.60582462801574
Xenopus tropicalis (Tropical clawed frog),409.94025918546004
Gopherus evgoodei (Goodes thornscrub tortoise),408.1645384911988
Ochotona princeps (Pika),404.4645602586058
Astyanax mexicanus (Mexican tetra),401.95164618331626
Gallus gallus (Chicken),396.7631120789479
Echinops telfairi (Lesser hedgehog tenrec),394.59981414942825
Pseudonaja textilis (Eastern brown snake),394.30620797943544
Anas platyrhynchos (Mallard),393.82520282263766
Terrapene carolina triunguis (Three-toed box turtle),392.73687736890116
Procavia capensis (Hyrax),390.2055585261809
Vulpes vulpes (Red fox),386.14795849877873
Latimeria chalumnae (Coelacanth),385.78107415754107
Phascolarctos cinereus (Koala),382.40745597523596
Podarcis muralis (Common wall lizard),381.7645950066727
Erpetoichthys calabaricus (Reedfish),380.79096862734787
Callorhinchus milii (Elephant shark),378.0172589583684
Parus major (Great Tit),377.74825609470065
Crocodylus porosus (Australian saltwater crocodile),373.9614315089934
Notamacropus eugenii (Wallaby),372.9909673602739
Ornithorhynchus anatinus (Platypus),353.44159185687204
Oryctolagus cuniculus (Rabbit),350.874840290927
Naja naja (Indian cobra),342.54704317545355
Dipodomys ordii (Kangaroo rat),331.6531187152645
Eptatretus burgeri (Hagfish),330.8191687433894
Notechis scutatus (Mainland tiger snake),325.1308952319197
Mandrillus leucophaeus (Drill),320.00445798645313
Myotis lucifugus (Microbat),315.0854300908333
Ficedula albicollis (Collared flycatcher),309.9759652413192
Bos mutus (Wild yak),306.32116988216126
Sphenodon punctatus (Tuatara),297.3296705325619
Tupaia belangeri (Tree Shrew),287.24742810116396
Carlito syrichta (Tarsier),280.807010434379
Tursiops truncatus (Dolphin),259.92625593617254
Anolis carolinensis (Green anole),231.40215242884648
Serinus canaria (Common canary),168.16762587863712
Bison bison bison (American bison),167.63871170521566
Erinaceus europaeus (Hedgehog),151.73624592477552
Meleagris gallopavo (Turkey),119.76816777664234
Struthio camelus australis (African ostrich),118.62365951349003
Panthera tigris altaica (Tiger),67.63609246830723
Geospiza fortis (Medium ground-finch),63.40956340956341
Ciona savignyi,61.8348623853211
Vicugna pacos (Alpaca),60.85011185682326
Sorex araneus (Shrew),48.32214765100672
Petromyzon marinus (Lamprey),31.56779661016949
