Species,Similarity
Canis lupus familiaris (Dog - Boxer),2897.77979379287
Macaca nemestrina (Pig-tailed macaque),1807.4459298955887
Pan troglodytes (Chimpanzee),1735.8383724234184
Rhinopithecus roxellana (Golden snub-nosed monkey),1697.7691896729025
Propithecus coquereli (Coquerel's sifaka),1649.3696617374278
Prolemur simus (Greater bamboo lemur),1647.3078026612075
Cercocebus atys (Sooty mangabey),1635.799513562021
Sciurus vulgaris (Eurasian red squirrel),1634.0406101956476
Urocitellus parryii (Arctic ground squirrel),1632.6381947009816
Pongo abelii (Sumatran orangutan),1626.363627134313
Moschus moschiferus (Siberian musk deer),1621.407470450639
Ovis aries (Sheep),1620.4366109301227
Cebus imitator (Panamanian white-faced capuchin),1618.6409556078206
Macaca mulatta (Macaque),1611.2386958634638
Neovison vison (American mink),1609.525516438544
Callithrix jacchus (White-tufted-ear marmoset),1599.515298042075
Rhinopithecus bieti (Black snub-nosed monkey),1594.9119097892587
Balaenoptera musculus (Blue whale),1556.442916452781
Phocoena sinus (Vaquita),1546.3879023891975
Felis catus (Cat),1542.932866143543
Sus scrofa (Pig - Hampshire),1540.3576189644725
Rhinolophus ferrumequinum (Greater horseshoe bat),1536.9494779818851
Physeter catodon (Sperm whale),1535.2026807110444
Octodon degus (Degu),1523.0348062057733
Aotus nancymaae (Ma's night monkey),1521.883941627953
Microtus ochrogaster (Prairie vole),1510.6276962503196
Peromyscus maniculatus bairdii (Northern American deer mouse),1510.588737131731
Gorilla gorilla gorilla (Gorilla),1510.2217688462974
Cricetulus griseus (Chinese hamster CriGri),1506.2522593588128
Mus pahari (Shrew mouse),1503.8343922426845
Mus musculus (Mouse),1499.8848036420186
Nomascus leucogenys (Gibbon),1488.99256925013
Rattus norvegicus (Rat),1486.5017488306737
Pan paniscus (Bonobo),1483.3576331126728
Macaca fascicularis (Crab-eating macaque),1482.8203620759984
Monodon monoceros (Narwhal),1469.3815137559616
Microcebus murinus (Mouse Lemur),1464.265244383911
Catagonus wagneri (Chacoan peccary),1456.3167576942808
Papio anubis (Olive baboon),1435.7669820512876
Ictidomys tridecemlineatus (Squirrel),1429.6720693518853
Mus caroli (Ryukyu mouse),1421.1909439452947
Mus spretus (Algerian mouse),1417.7243443258753
Jaculus jaculus (Lesser Egyptian jerboa),1407.3268792437061
Panthera leo (Lion),1387.0756652855803
Panthera pardus (Leopard),1362.229936905045
Camelus dromedarius (Arabian camel),1361.1295899306783
Nannospalax galili (Upper Galilee mountains blind mole rat),1354.0134933257534
Capra hircus (Goat (black bengal)),1351.6978962696744
Ailuropoda melanoleuca (Giant panda),1347.7504036007058
Loxodonta africana (Elephant),1343.243820873407
Otolemur garnettii (Bushbaby),1339.4614385557506
Bos taurus (Cow),1337.2369620161521
Marmota marmota marmota (Alpine marmot),1334.4138908234713
Bos grunniens (Domestic yak),1332.0170076494649
Mandrillus leucophaeus (Drill),1296.325925703874
Mustela putorius furo (Ferret),1271.4705100468
Cavia porcellus (Guinea Pig),1269.6233753641875
Dasypus novemcinctus (Armadillo),1252.91012447969
Chinchilla lanigera (Long-tailed chinchilla),1244.770253655966
Mesocricetus auratus (Golden Hamster),1243.7270585641145
Mus spicilegus (Steppe mouse),1239.6765232357202
Saimiri boliviensis boliviensis (Bolivian squirrel monkey),1226.3169397925408
Chlorocebus sabaeus (Vervet-AGM),1201.7033629030855
Equus caballus (Horse),1186.9957681371022
Bison bison bison (American bison),1169.1773540454878
Dipodomys ordii (Kangaroo rat),1154.8195770991497
Equus asinus (Donkey),1107.952632745995
Cervus hanglu yarkandensis (Yarkand deer),1096.5247660177392
Bos indicus x Bos taurus (Hybrid - Bos Taurus),1090.6623160510594
Delphinapterus leucas (Beluga whale),1089.831505618167
Heterocephalus glaber (Naked mole-rat),1075.585636938445
Ursus americanus (American black bear),1058.5653176044636
Bos mutus (Wild yak),988.8752091020124
Pteropus vampyrus (Megabat),984.2306585785216
Carlito syrichta (Tarsier),894.370981560161
Oryctolagus cuniculus (Rabbit),884.1825028373526
Vulpes vulpes (Red fox),883.771120886084
Myotis lucifugus (Microbat),882.5960533485937
Ursus maritimus (Polar bear),875.2724151158401
Procavia capensis (Hyrax),821.6983939838524
Tursiops truncatus (Dolphin),792.890747569367
Phascolarctos cinereus (Koala),785.1020379254078
Vombatus ursinus (Common wombat),703.6617672806553
Panthera tigris altaica (Tiger),702.5913548265713
Monodelphis domestica (Opossum),688.0543095567427
Sarcophilus harrisii (Tasmanian devil),681.6163300585524
Echinops telfairi (Lesser hedgehog tenrec),600.3256216531723
Strigops habroptila (Kakapo),592.8660330223448
Taeniopygia guttata (Zebra finch),589.7587283570547
Terrapene carolina triunguis (Three-toed box turtle),507.5986439102279
Coturnix japonica (Japanese quail),502.1919753387889
Gallus gallus (Chicken),431.74262586541164
Chrysemys picta bellii (Painted turtle),430.5244636972094
Tupaia belangeri (Tree Shrew),428.6531663798669
Chelonoidis abingdonii (Abingdon island giant tortoise),426.8397903510324
Sphenodon punctatus (Tuatara),425.5130131450779
Aquila chrysaetos chrysaetos (Golden eagle),420.03905721976275
Parus major (Great Tit),419.64125822136435
Crocodylus porosus (Australian saltwater crocodile),343.55272114106265
Ochotona princeps (Pika),342.42024186836454
Ficedula albicollis (Collared flycatcher),336.50094379628445
Erinaceus europaeus (Hedgehog),336.1061711825238
Podarcis muralis (Common wall lizard),333.39329869571384
Anser brachyrhynchus (Pink-footed goose),332.15788871793467
Pseudonaja textilis (Eastern brown snake),325.96405815701024
Hucho hucho (Huchen),322.81779366285355
Gopherus evgoodei (Goodes thornscrub tortoise),257.0896765024801
Anas platyrhynchos (Mallard),256.97849464591127
Pelodiscus sinensis (Chinese softshell turtle),254.19920269285058
Notechis scutatus (Mainland tiger snake),252.90044525710172
Anolis carolinensis (Green anole),249.89217187506173
Latimeria chalumnae (Coelacanth),249.63911886766658
Naja naja (Indian cobra),246.04870701065363
Salmo trutta (Brown trout),242.33909313148195
Choloepus hoffmanni (Sloth),181.8985291788639
Sorex araneus (Shrew),174.17288408789824
Notamacropus eugenii (Wallaby),172.47036666699026
Geospiza fortis (Medium ground-finch),171.2543728135932
Salvator merianae (Argentine black and white tegu),166.09183191690275
Leptobrachium leishanense (Leishan spiny toad),165.50426317868175
Cyprinodon variegatus (Sheepshead minnow),165.48275659542207
Xenopus tropicalis (Tropical clawed frog),165.3403319481908
Lepisosteus oculatus (Spotted gar),165.2795211529521
Oreochromis niloticus (Nile tilapia),165.05433231775942
Erpetoichthys calabaricus (Reedfish),165.03466368509476
Haplochromis burtoni (Burton's mouthbrooder),164.65997770345595
Oryzias latipes (Japanese medaka HdrR),164.04220215816198
Seriola lalandi dorsalis (Yellowtail amberjack),162.03923837576266
Oncorhynchus mykiss (Rainbow trout),161.93187450547828
Oncorhynchus tshawytscha (Chinook salmon),161.85661202657545
Oncorhynchus kisutch (Coho salmon),161.61578555472823
Salmo salar (Atlantic salmon),161.3479747423924
Ornithorhynchus anatinus (Platypus),88.78576952822893
Serinus canaria (Common canary),85.04958047292143
Meleagris gallopavo (Turkey),84.13424866514111
Danio rerio (Zebrafish),84.05797101449275
Acanthochromis polyacanthus (Spiny chromis),83.80221653878944
Struthio camelus australis (African ostrich),83.44774980930588
Callorhinchus milii (Elephant shark),83.40163934426229
Amphilophus citrinellus (Midas cichlid),83.20545609548167
Ictalurus punctatus (Channel catfish),83.09178743961353
Poecilia formosa (Amazon molly),82.94970161977835
Denticeps clupeoides (Denticle herring),82.91492329149233
Anabas testudineus (Climbing perch),82.84722222222223
Pundamilia nyererei (Makobe Island cichlid),82.69394714407503
Neolamprologus brichardi (Lyretail cichlid),82.69394714407503
Pygocentrus nattereri (Red-bellied piranha),82.6056826056826
Fundulus heteroclitus (Mummichog),82.12058212058211
Betta splendens (Siamese fighting fish),82.08852005532503
Oryzias sinensis (Chinese medaka),82.04592901878914
Larimichthys crocea (Large yellow croaker),82.02479338842976
Maylandia zebra (Zebra mbuna),81.98198198198197
Hippocampus comes (Tiger tail seahorse),81.67092924126173
Gasterosteus aculeatus (Stickleback),81.64251207729468
Dicentrarchus labrax (European seabass),81.38261464750171
Poecilia reticulata (Guppy),81.3807531380753
Xiphophorus maculatus (Platyfish),81.3110181311018
Esox lucius (Northern pike),81.24467178175618
Takifugu rubripes (Fugu),81.23711340206185
Cyclopterus lumpus (Lumpfish),81.23711340206185
Mastacembelus armatus (Zig-zag eel),81.03207810320781
Amphiprion percula (Orange clownfish),80.9623430962343
Stegastes partitus (Bicolor damselfish),80.93249826026444
Oryzias melastigma (Indian medaka),80.8228730822873
Oryzias javanicus (Javanese ricefish),80.61366806136681
Lates calcarifer (Barramundi perch),80.58384249830279
Scleropages formosus (Asian bonytongue),80.56708160442601
Kryptolebias marmoratus (Mangrove rivulus),80.5439330543933
Sander lucioperca (Pike-perch),80.23415977961432
Vicugna pacos (Alpaca),80.0
